textos,tokens,tokens_sin_innecesarios,lematizados,lematizados_str,pred_KNN,pred_RedNeuronal,pred_SVM,pred_SVM_ODS,pred_KNN_ODS,pred_RedNeuronal_ODS
australia occidental por ejemplo ha implementado una revisión obligatoria de todas las muertes que ocurren en hospitales públicos y centros de salud privados que brindan servicios a pacientes públicos queensland lleva a cabo una auditoría de cabecera anual donde los médicos recopilan información sobre ciertos elementos de la atención para evaluar si se han cumplido los estándares esperados a nivel nacional el royal australasian college of surgeons establece como requisito para participar en el australian auditoría de mortalidad quirúrgica de zelanda como parte del programa de desarrollo profesional continuo de la universidad el acsqhc también realiza auditorías para evaluar el cumplimiento de los estándares la mayoría de los datos se centran en los volúmenes de atención y los recursos dentro del sistema los datos clínicos también se recopilan casi exclusivamente a través de registros específicos organizados por enfermedad dirigidos a grupos específicos de población o basados ​​en hospitales,"['australia', 'occidental', 'por', 'ejemplo', 'ha', 'implementado', 'una', 'revisión', 'obligatoria', 'de', 'todas', 'las', 'muertes', 'que', 'ocurren', 'en', 'hospitales', 'públicos', 'y', 'centros', 'de', 'salud', 'privados', 'que', 'brindan', 'servicios', 'a', 'pacientes', 'públicos', 'queensland', 'lleva', 'a', 'cabo', 'una', 'auditoría', 'de', 'cabecera', 'anual', 'donde', 'los', 'médicos', 'recopilan', 'información', 'sobre', 'ciertos', 'elementos', 'de', 'la', 'atención', 'para', 'evaluar', 'si', 'se', 'han', 'cumplido', 'los', 'estándares', 'esperados', 'a', 'nivel', 'nacional', 'el', 'royal', 'australasian', 'college', 'of', 'surgeons', 'establece', 'como', 'requisito', 'para', 'participar', 'en', 'el', 'australian', 'auditoría', 'de', 'mortalidad', 'quirúrgica', 'de', 'zelanda', 'como', 'parte', 'del', 'programa', 'de', 'desarrollo', 'profesional', 'continuo', 'de', 'la', 'universidad', 'el', 'acsqhc', 'también', 'realiza', 'auditorías', 'para', 'evaluar', 'el', 'cumplimiento', 'de', 'los', 'estándares', 'la', 'mayoría', 'de', 'los', 'datos', 'se', 'centran', 'en', 'los', 'volúmenes', 'de', 'atención', 'y', 'los', 'recursos', 'dentro', 'del', 'sistema', 'los', 'datos', 'clínicos', 'también', 'se', 'recopilan', 'casi', 'exclusivamente', 'a', 'través', 'de', 'registros', 'específicos', 'organizados', 'por', 'enfermedad', 'dirigidos', 'a', 'grupos', 'específicos', 'de', 'población', 'o', 'basados', '\u200b\u200ben', 'hospitales']","['australia', 'occidental', 'ejemplo', 'implementado', 'revisión', 'obligatoria', 'muertes', 'ocurren', 'hospitales', 'públicos', 'centros', 'salud', 'privados', 'brindan', 'servicios', 'pacientes', 'públicos', 'queensland', 'cabo', 'auditoría', 'cabecera', 'anual', 'médicos', 'recopilan', 'información', 'elementos', 'atención', 'evaluar', 'cumplido', 'estándares', 'esperados', 'nivel', 'nacional', 'royal', 'australasian', 'college', 'of', 'surgeons', 'establece', 'requisito', 'participar', 'australian', 'auditoría', 'mortalidad', 'quirúrgica', 'zelanda', 'programa', 'desarrollo', 'profesional', 'continuo', 'universidad', 'acsqhc', 'realiza', 'auditorías', 'evaluar', 'cumplimiento', 'estándares', 'mayoría', 'datos', 'centran', 'volúmenes', 'atención', 'recursos', 'sistema', 'datos', 'clínicos', 'recopilan', 'exclusivamente', 'registros', 'específicos', 'organizados', 'enfermedad', 'dirigidos', 'grupos', 'específicos', 'población', 'basados', '\u200b\u200ben', 'hospitales']","['australia', 'occidental', 'ejemplo', 'implementado', 'revisión', 'obligatorio', 'muerte', 'ocurrir', 'hospital', 'público', 'centro', 'salud', 'privado', 'brindar', 'servicio', 'paciente', 'público', 'queensland', 'cabo', 'auditoriar', 'cabecero', 'anual', 'médico', 'recopilar', 'información', 'elemento', 'atención', 'evaluar', 'cumplido', 'estándar', 'esperado', 'nivel', 'nacional', 'royal', 'australasian', 'college', 'of', 'surgeons', 'establecer', 'requisito', 'participar', 'australian', 'auditoría', 'mortalidad', 'quirúrgico', 'zelando', 'programa', 'desarrollo', 'profesional', 'continuo', 'universidad', 'acsqhc', 'realizar', 'auditorías', 'evaluar', 'cumplimiento', 'estándar', 'mayoer', 'dato', 'centrar', 'volumen', 'atención', 'recurso', 'sistema', 'dato', 'clínico', 'recopilar', 'exclusivamente', 'registro', 'específico', 'organizado', 'enfermedad', 'dirigido', 'grupo', 'específico', 'población', 'basado', '\u200b\u200ben', 'hospital']",australia occidental ejemplo implementado revisión obligatorio muerte ocurrir hospital público centro salud privado brindar servicio paciente público queensland cabo auditoriar cabecero anual médico recopilar información elemento atención evaluar cumplido estándar esperado nivel nacional royal australasian college of surgeons establecer requisito participar australian auditoría mortalidad quirúrgico zelando programa desarrollo profesional continuo universidad acsqhc realizar auditorías evaluar cumplimiento estándar mayoer dato centrar volumen atención recurso sistema dato clínico recopilar exclusivamente registro específico organizado enfermedad dirigido grupo específico población basado ​​en hospital,3,3,3,ODS 3,ODS 3,ODS 3
de hecho ese fue uno de los objetivos iniciales declarados del software cuando se desarrolló por primera vez incluye registros de salida detallados de todos los cálculos del software povcal incluidos los parámetros estimados de la curva de lorenz en cada caso llevar las nociones de pobreza de la ocde a este conjunto de datos en su mayoría no perteneciente a la ocde requiere extender el marco metodológico de povcal para derivar la medida de bienestar medio directamente de los parámetros de la curva de lorenz que estima povcal a partir de datos de distribución agrupados,"['de', 'hecho', 'ese', 'fue', 'uno', 'de', 'los', 'objetivos', 'iniciales', 'declarados', 'del', 'software', 'cuando', 'se', 'desarrolló', 'por', 'primera', 'vez', 'incluye', 'registros', 'de', 'salida', 'detallados', 'de', 'todos', 'los', 'cálculos', 'del', 'software', 'povcal', 'incluidos', 'los', 'parámetros', 'estimados', 'de', 'la', 'curva', 'de', 'lorenz', 'en', 'cada', 'caso', 'llevar', 'las', 'nociones', 'de', 'pobreza', 'de', 'la', 'ocde', 'a', 'este', 'conjunto', 'de', 'datos', 'en', 'su', 'mayoría', 'no', 'perteneciente', 'a', 'la', 'ocde', 'requiere', 'extender', 'el', 'marco', 'metodológico', 'de', 'povcal', 'para', 'derivar', 'la', 'medida', 'de', 'bienestar', 'medio', 'directamente', 'de', 'los', 'parámetros', 'de', 'la', 'curva', 'de', 'lorenz', 'que', 'estima', 'povcal', 'a', 'partir', 'de', 'datos', 'de', 'distribución', 'agrupados']","['objetivos', 'iniciales', 'declarados', 'software', 'desarrolló', 'incluye', 'registros', 'salida', 'detallados', 'cálculos', 'software', 'povcal', 'incluidos', 'parámetros', 'estimados', 'curva', 'lorenz', 'caso', 'nociones', 'pobreza', 'ocde', 'conjunto', 'datos', 'mayoría', 'perteneciente', 'ocde', 'requiere', 'extender', 'marco', 'metodológico', 'povcal', 'derivar', 'medida', 'bienestar', 'directamente', 'parámetros', 'curva', 'lorenz', 'estima', 'povcal', 'datos', 'distribución', 'agrupados']","['objetivo', 'inicial', 'declarado', 'software', 'desarrollar', 'incluir', 'registro', 'salido', 'detallado', 'cálculo', 'software', 'povcal', 'incluido', 'parámetro', 'estimado', 'curvo', 'lorenz', 'caso', 'nociones', 'pobreza', 'ocde', 'conjunto', 'dato', 'mayoría', 'perteneciente', 'ocde', 'requerir', 'extender', 'marco', 'metodológico', 'povcal', 'derivar', 'medido', 'bienestar', 'directamente', 'parámetro', 'curvo', 'lorenz', 'estimar', 'povcal', 'dato', 'distribución', 'agrupado']",objetivo inicial declarado software desarrollar incluir registro salido detallado cálculo software povcal incluido parámetro estimado curvo lorenz caso nociones pobreza ocde conjunto dato mayoría perteneciente ocde requerir extender marco metodológico povcal derivar medido bienestar directamente parámetro curvo lorenz estimar povcal dato distribución agrupado,1,1,1,ODS 1,ODS 1,ODS 1
el proyecto involucró a 15 clínicas primarias y 239 pacientes después de que los pacientes transmitieran información biométrica medida por ellos mismos al sistema de monitoreo a través de la puerta de enlace en una aplicación de teléfono inteligente los médicos revisaron los datos y dieron retroalimentación directamente a cada persona entre el inicio del proyecto y tres meses después para el grupo de prueba los niveles de hbalc disminuyeron en promedio 064 puntos porcentuales de 798 a 735 puntos porcentuales mientras que para el grupo de control la caída fue de 036 puntos porcentuales,"['el', 'proyecto', 'involucró', 'a', '15', 'clínicas', 'primarias', 'y', '239', 'pacientes', 'después', 'de', 'que', 'los', 'pacientes', 'transmitieran', 'información', 'biométrica', 'medida', 'por', 'ellos', 'mismos', 'al', 'sistema', 'de', 'monitoreo', 'a', 'través', 'de', 'la', 'puerta', 'de', 'enlace', 'en', 'una', 'aplicación', 'de', 'teléfono', 'inteligente', 'los', 'médicos', 'revisaron', 'los', 'datos', 'y', 'dieron', 'retroalimentación', 'directamente', 'a', 'cada', 'persona', 'entre', 'el', 'inicio', 'del', 'proyecto', 'y', 'tres', 'meses', 'después', 'para', 'el', 'grupo', 'de', 'prueba', 'los', 'niveles', 'de', 'hbalc', 'disminuyeron', 'en', 'promedio', '064', 'puntos', 'porcentuales', 'de', '798', 'a', '735', 'puntos', 'porcentuales', 'mientras', 'que', 'para', 'el', 'grupo', 'de', 'control', 'la', 'caída', 'fue', 'de', '036', 'puntos', 'porcentuales']","['proyecto', 'involucró', '15', 'clínicas', 'primarias', '239', 'pacientes', 'pacientes', 'transmitieran', 'información', 'biométrica', 'medida', 'sistema', 'monitoreo', 'puerta', 'enlace', 'aplicación', 'teléfono', 'inteligente', 'médicos', 'revisaron', 'datos', 'retroalimentación', 'directamente', 'persona', 'inicio', 'proyecto', 'meses', 'grupo', 'prueba', 'niveles', 'hbalc', 'disminuyeron', 'promedio', '064', 'puntos', 'porcentuales', '798', '735', 'puntos', 'porcentuales', 'grupo', 'control', 'caída', '036', 'puntos', 'porcentuales']","['proyecto', 'involucró', '15', 'clínica', 'primario', '239', 'paciente', 'paciente', 'transmitir', 'información', 'biométrico', 'medido', 'sistema', 'monitoreo', 'puerta', 'enlacir', 'aplicación', 'teléfono', 'inteligente', 'médico', 'revisar', 'dato', 'retroalimentación', 'directamente', 'persona', 'inicio', 'proyecto', 'meses', 'grupo', 'probar', 'nivele', 'hbalc', 'disminuir', 'promedio', '064', 'punto', 'porcentual', '798', '735', 'punto', 'porcentual', 'grupo', 'control', 'caído', '036', 'punto', 'porcentual']",proyecto involucró 15 clínica primario 239 paciente paciente transmitir información biométrico medido sistema monitoreo puerta enlacir aplicación teléfono inteligente médico revisar dato retroalimentación directamente persona inicio proyecto meses grupo probar nivele hbalc disminuir promedio 064 punto porcentual 798 735 punto porcentual grupo control caído 036 punto porcentual,4,3,3,ODS 3,ODS 4,ODS 3
casi todos los estudiantes continúan aprendiendo en la educación secundaria superior más allá de la educación obligatoria todo esto se logra en un sistema escolar que brinda amplia autonomía a los líderes escolares y maestros y se logra con niveles de gasto comparativamente modestos las disminuciones continuas en el tamaño de la población en edad escolar desafían a las autoridades a administrar de manera eficiente la red escolar de la nación la capacidad de la nación para reponer su fuerza laboral docente se ve obstaculizada por condiciones de empleo poco atractivas una visión poco clara de lo que son las buenas prácticas docentes y qué tipo de capacitación puede promover mejor la buena enseñanza,"['casi', 'todos', 'los', 'estudiantes', 'continúan', 'aprendiendo', 'en', 'la', 'educación', 'secundaria', 'superior', 'más', 'allá', 'de', 'la', 'educación', 'obligatoria', 'todo', 'esto', 'se', 'logra', 'en', 'un', 'sistema', 'escolar', 'que', 'brinda', 'amplia', 'autonomía', 'a', 'los', 'líderes', 'escolares', 'y', 'maestros', 'y', 'se', 'logra', 'con', 'niveles', 'de', 'gasto', 'comparativamente', 'modestos', 'las', 'disminuciones', 'continuas', 'en', 'el', 'tamaño', 'de', 'la', 'población', 'en', 'edad', 'escolar', 'desafían', 'a', 'las', 'autoridades', 'a', 'administrar', 'de', 'manera', 'eficiente', 'la', 'red', 'escolar', 'de', 'la', 'nación', 'la', 'capacidad', 'de', 'la', 'nación', 'para', 'reponer', 'su', 'fuerza', 'laboral', 'docente', 'se', 've', 'obstaculizada', 'por', 'condiciones', 'de', 'empleo', 'poco', 'atractivas', 'una', 'visión', 'poco', 'clara', 'de', 'lo', 'que', 'son', 'las', 'buenas', 'prácticas', 'docentes', 'y', 'qué', 'tipo', 'de', 'capacitación', 'puede', 'promover', 'mejor', 'la', 'buena', 'enseñanza']","['estudiantes', 'continúan', 'aprendiendo', 'educación', 'secundaria', 'superior', 'allá', 'educación', 'obligatoria', 'logra', 'sistema', 'escolar', 'brinda', 'amplia', 'autonomía', 'líderes', 'escolares', 'maestros', 'logra', 'niveles', 'gasto', 'comparativamente', 'modestos', 'disminuciones', 'continuas', 'tamaño', 'población', 'edad', 'escolar', 'desafían', 'autoridades', 'administrar', 'eficiente', 'red', 'escolar', 'nación', 'capacidad', 'nación', 'reponer', 'fuerza', 'laboral', 'docente', 've', 'obstaculizada', 'condiciones', 'empleo', 'atractivas', 'visión', 'clara', 'prácticas', 'docentes', 'tipo', 'capacitación', 'promover', 'enseñanza']","['estudiante', 'continuar', 'aprender', 'educación', 'secundario', 'superior', 'allá', 'educación', 'obligatorio', 'lograr', 'sistema', 'escolar', 'brinda', 'amplio', 'autonomía', 'líder', 'escolar', 'maestro', 'lograr', 'nivel', 'gasto', 'comparativamente', 'modesto', 'disminución', 'continuo', 'tamaño', 'población', 'edad', 'escolar', 'desafir', 'autoridad', 'administrar', 'eficiente', 'red', 'escolar', 'nación', 'capacidad', 'nación', 'reponer', 'fuerza', 'laboral', 'docente', 'ver', 'obstaculizado', 'condición', 'empleo', 'atractivo', 'visión', 'claro', 'práctica', 'docente', 'tipo', 'capacitación', 'promover', 'enseñanza']",estudiante continuar aprender educación secundario superior allá educación obligatorio lograr sistema escolar brinda amplio autonomía líder escolar maestro lograr nivel gasto comparativamente modesto disminución continuo tamaño población edad escolar desafir autoridad administrar eficiente red escolar nación capacidad nación reponer fuerza laboral docente ver obstaculizado condición empleo atractivo visión claro práctica docente tipo capacitación promover enseñanza,4,4,4,ODS 4,ODS 4,ODS 4
de los siete países para los que se puede estimar la pobreza infantil el banco mundial clasifica a guyana como de ingreso medio-bajo a belice granada jamaica santa lucía y surinam como de ingreso medio-alto y a antigua y barbuda y trinidad y tobago como de ingreso alto sin embargo ni el ingreso nacional ni la pobreza monetaria explican completamente la variabilidad en los niveles de pobreza infantil por ejemplo aunque trinidad y tobago tiene el producto interno bruto per cápita más alto del caribe no tiene el nivel más bajo de pobreza infantil,"['de', 'los', 'siete', 'países', 'para', 'los', 'que', 'se', 'puede', 'estimar', 'la', 'pobreza', 'infantil', 'el', 'banco', 'mundial', 'clasifica', 'a', 'guyana', 'como', 'de', 'ingreso', 'medio-bajo', 'a', 'belice', 'granada', 'jamaica', 'santa', 'lucía', 'y', 'surinam', 'como', 'de', 'ingreso', 'medio-alto', 'y', 'a', 'antigua', 'y', 'barbuda', 'y', 'trinidad', 'y', 'tobago', 'como', 'de', 'ingreso', 'alto', 'sin', 'embargo', 'ni', 'el', 'ingreso', 'nacional', 'ni', 'la', 'pobreza', 'monetaria', 'explican', 'completamente', 'la', 'variabilidad', 'en', 'los', 'niveles', 'de', 'pobreza', 'infantil', 'por', 'ejemplo', 'aunque', 'trinidad', 'y', 'tobago', 'tiene', 'el', 'producto', 'interno', 'bruto', 'per', 'cápita', 'más', 'alto', 'del', 'caribe', 'no', 'tiene', 'el', 'nivel', 'más', 'bajo', 'de', 'pobreza', 'infantil']","['países', 'estimar', 'pobreza', 'infantil', 'banco', 'mundial', 'clasifica', 'guyana', 'ingreso', 'medio-bajo', 'belice', 'granada', 'jamaica', 'santa', 'lucía', 'surinam', 'ingreso', 'medio-alto', 'antigua', 'barbuda', 'trinidad', 'tobago', 'ingreso', 'alto', 'ingreso', 'nacional', 'pobreza', 'monetaria', 'explican', 'completamente', 'variabilidad', 'niveles', 'pobreza', 'infantil', 'ejemplo', 'trinidad', 'tobago', 'producto', 'interno', 'bruto', 'per', 'cápita', 'alto', 'caribe', 'nivel', 'pobreza', 'infantil']","['país', 'estimar', 'pobreza', 'infantil', 'banco', 'mundial', 'clasifica', 'guyana', 'ingreso', 'medio-bajo', 'belice', 'granada', 'jamaica', 'santa', 'lucía', 'surinam', 'ingreso', 'medio-alto', 'antiguo', 'barbudo', 'trinidad', 'tobago', 'ingreso', 'alto', 'ingreso', 'nacional', 'pobreza', 'monetario', 'explicar', 'completamente', 'variabilidad', 'nivel', 'pobreza', 'infantil', 'ejemplo', 'trinidad', 'tobago', 'producto', 'interno', 'bruto', 'per', 'cápita', 'alto', 'caribir', 'nivel', 'pobreza', 'infantil']",país estimar pobreza infantil banco mundial clasifica guyana ingreso medio-bajo belice granada jamaica santa lucía surinam ingreso medio-alto antiguo barbudo trinidad tobago ingreso alto ingreso nacional pobreza monetario explicar completamente variabilidad nivel pobreza infantil ejemplo trinidad tobago producto interno bruto per cápita alto caribir nivel pobreza infantil,1,1,1,ODS 1,ODS 1,ODS 1
como se discutirá con más detalle más adelante el impacto directo de las exportaciones sobre la pobreza puede ser adicional a su efecto de reducción de la pobreza dependiendo del tipo de exportaciones a través de su impacto general de mejora del crecimiento la evidencia a nivel agregado presta apoyo definitivo a la proposición de que las exportaciones juegan un papel especial en la reducción de la pobreza ver figura 26 el gráfico indica que los índices de pobreza disminuyen cuando aumentan las exportaciones reales per cápita,"['como', 'se', 'discutirá', 'con', 'más', 'detalle', 'más', 'adelante', 'el', 'impacto', 'directo', 'de', 'las', 'exportaciones', 'sobre', 'la', 'pobreza', 'puede', 'ser', 'adicional', 'a', 'su', 'efecto', 'de', 'reducción', 'de', 'la', 'pobreza', 'dependiendo', 'del', 'tipo', 'de', 'exportaciones', 'a', 'través', 'de', 'su', 'impacto', 'general', 'de', 'mejora', 'del', 'crecimiento', 'la', 'evidencia', 'a', 'nivel', 'agregado', 'presta', 'apoyo', 'definitivo', 'a', 'la', 'proposición', 'de', 'que', 'las', 'exportaciones', 'juegan', 'un', 'papel', 'especial', 'en', 'la', 'reducción', 'de', 'la', 'pobreza', 'ver', 'figura', '26', 'el', 'gráfico', 'indica', 'que', 'los', 'índices', 'de', 'pobreza', 'disminuyen', 'cuando', 'aumentan', 'las', 'exportaciones', 'reales', 'per', 'cápita']","['discutirá', 'detalle', 'impacto', 'directo', 'exportaciones', 'pobreza', 'adicional', 'efecto', 'reducción', 'pobreza', 'dependiendo', 'tipo', 'exportaciones', 'impacto', 'general', 'mejora', 'crecimiento', 'evidencia', 'nivel', 'agregado', 'presta', 'apoyo', 'definitivo', 'proposición', 'exportaciones', 'juegan', 'papel', 'especial', 'reducción', 'pobreza', 'figura', '26', 'gráfico', 'indica', 'índices', 'pobreza', 'disminuyen', 'aumentan', 'exportaciones', 'reales', 'per', 'cápita']","['discutir', 'detalle', 'impacto', 'directo', 'exportación', 'pobreza', 'adicional', 'efecto', 'reducción', 'pobreza', 'depender', 'tipo', 'exportación', 'impacto', 'general', 'mejorar', 'crecimiento', 'evidenciar', 'nivel', 'agregado', 'prestar', 'apoyo', 'definitivo', 'proposición', 'exportación', 'jugar', 'papel', 'especial', 'reducción', 'pobreza', 'figurar', '26', 'gráfico', 'indicar', 'índice', 'pobrezo', 'disminuir', 'aumentar', 'exportación', 'real', 'per', 'cápita']",discutir detalle impacto directo exportación pobreza adicional efecto reducción pobreza depender tipo exportación impacto general mejorar crecimiento evidenciar nivel agregado prestar apoyo definitivo proposición exportación jugar papel especial reducción pobreza figurar 26 gráfico indicar índice pobrezo disminuir aumentar exportación real per cápita,1,1,1,ODS 1,ODS 1,ODS 1
esto significa que las personashogares a los que les falta cierto bien o bien duradero se ven privados de ese bien o bien duradero solo si el motivo de la falta es que no pueden permitírselo véase por ejemplo de neubourg et al 2012a guio 2009 guio et al 2009 whelan and mattre 2012 nolan and whelan 2010 fusco et al 2011 y fusco et al 2013 permite identificar a los niños individuales sobre la base de si sufren pobreza monetaria carencias multidimensionales ambas o ninguna de ellas esto permite explorar la distribución subyacente del consumo o del ingreso y las relaciones entre privación privación múltiple y pobreza monetaria,"['esto', 'significa', 'que', 'las', 'personashogares', 'a', 'los', 'que', 'les', 'falta', 'cierto', 'bien', 'o', 'bien', 'duradero', 'se', 'ven', 'privados', 'de', 'ese', 'bien', 'o', 'bien', 'duradero', 'solo', 'si', 'el', 'motivo', 'de', 'la', 'falta', 'es', 'que', 'no', 'pueden', 'permitírselo', 'véase', 'por', 'ejemplo', 'de', 'neubourg', 'et', 'al', '2012a', 'guio', '2009', 'guio', 'et', 'al', '2009', 'whelan', 'and', 'mattre', '2012', 'nolan', 'and', 'whelan', '2010', 'fusco', 'et', 'al', '2011', 'y', 'fusco', 'et', 'al', '2013', 'permite', 'identificar', 'a', 'los', 'niños', 'individuales', 'sobre', 'la', 'base', 'de', 'si', 'sufren', 'pobreza', 'monetaria', 'carencias', 'multidimensionales', 'ambas', 'o', 'ninguna', 'de', 'ellas', 'esto', 'permite', 'explorar', 'la', 'distribución', 'subyacente', 'del', 'consumo', 'o', 'del', 'ingreso', 'y', 'las', 'relaciones', 'entre', 'privación', 'privación', 'múltiple', 'y', 'pobreza', 'monetaria']","['significa', 'personashogares', 'falta', 'duradero', 'ven', 'privados', 'duradero', 'motivo', 'falta', 'permitírselo', 'véase', 'ejemplo', 'neubourg', 'et', '2012a', 'guio', '2009', 'guio', 'et', '2009', 'whelan', 'and', 'mattre', '2012', 'nolan', 'and', 'whelan', '2010', 'fusco', 'et', '2011', 'fusco', 'et', '2013', 'permite', 'identificar', 'niños', 'individuales', 'base', 'sufren', 'pobreza', 'monetaria', 'carencias', 'multidimensionales', 'ambas', 'permite', 'explorar', 'distribución', 'subyacente', 'consumo', 'ingreso', 'relaciones', 'privación', 'privación', 'múltiple', 'pobreza', 'monetaria']","['significar', 'personashogar', 'falta', 'duradero', 'ver', 'privado', 'duradero', 'motivo', 'faltar', 'permitírselo', 'véar', 'ejemplo', 'neubourg', 'et', '2012a', 'guio', '2009', 'guio', 'et', '2009', 'whelan', 'and', 'mattre', '2012', 'nolan', 'and', 'whelan', '2010', 'fusco', 'et', '2011', 'fusco', 'et', '2013', 'permitir', 'identificar', 'niño', 'individual', 'base', 'sufrir', 'pobreza', 'monetario', 'carencia', 'multidimensional', 'ambos', 'permitir', 'explorar', 'distribución', 'subyacente', 'consumo', 'ingreso', 'relación', 'privación', 'privación', 'múltiple', 'pobreza', 'monetario']",significar personashogar falta duradero ver privado duradero motivo faltar permitírselo véar ejemplo neubourg et 2012a guio 2009 guio et 2009 whelan and mattre 2012 nolan and whelan 2010 fusco et 2011 fusco et 2013 permitir identificar niño individual base sufrir pobreza monetario carencia multidimensional ambos permitir explorar distribución subyacente consumo ingreso relación privación privación múltiple pobreza monetario,1,1,1,ODS 1,ODS 1,ODS 1
