textos,tokens,tokens_sin_innecesarios,lematizados,lematizados_str,pred_KNN,pred_RedNeuronal,pred_SVM,pred_SVM_ODS,pred_KNN_ODS,pred_RedNeuronal_ODS
en varios estados y territorios de australia bélgica comunidad francesa en varias provincias y territorios de canadá chile evaluación del desempeño y nueva zelanda por ejemplo queda a discreción de los líderes y evaluadores escolares seleccionar los instrumentos y herramientas para recabar información dependiendo de los aspectos y criterios de evaluación elegidos yo de los objetivos de desempeño definidos individualmente los instrumentos y las fuentes de información utilizados para reunir pruebas sobre el desempeño de un líder escolar también pueden diferir entre los puestos de liderazgo los directores escolares y los subdirectores escolares aunque los costos y esfuerzos requeridos deben sopesarse con los beneficios de usar múltiples fuentes de información es esencial reunir una cantidad factible de información precisa válida confiable y útil glasman y glasman 2010 estas reuniones entre evaluador y evaluado pueden basarse simplemente en una lista de comprobación que examine si se ha demostrado un aspecto de la evaluación lashway 2003,"['en', 'varios', 'estados', 'y', 'territorios', 'de', 'australia', 'bélgica', 'comunidad', 'francesa', 'en', 'varias', 'provincias', 'y', 'territorios', 'de', 'canadá', 'chile', 'evaluación', 'del', 'desempeño', 'y', 'nueva', 'zelanda', 'por', 'ejemplo', 'queda', 'a', 'discreción', 'de', 'los', 'líderes', 'y', 'evaluadores', 'escolares', 'seleccionar', 'los', 'instrumentos', 'y', 'herramientas', 'para', 'recabar', 'información', 'dependiendo', 'de', 'los', 'aspectos', 'y', 'criterios', 'de', 'evaluación', 'elegidos', 'yo', 'de', 'los', 'objetivos', 'de', 'desempeño', 'definidos', 'individualmente', 'los', 'instrumentos', 'y', 'las', 'fuentes', 'de', 'información', 'utilizados', 'para', 'reunir', 'pruebas', 'sobre', 'el', 'desempeño', 'de', 'un', 'líder', 'escolar', 'también', 'pueden', 'diferir', 'entre', 'los', 'puestos', 'de', 'liderazgo', 'los', 'directores', 'escolares', 'y', 'los', 'subdirectores', 'escolares', 'aunque', 'los', 'costos', 'y', 'esfuerzos', 'requeridos', 'deben', 'sopesarse', 'con', 'los', 'beneficios', 'de', 'usar', 'múltiples', 'fuentes', 'de', 'información', 'es', 'esencial', 'reunir', 'una', 'cantidad', 'factible', 'de', 'información', 'precisa', 'válida', 'confiable', 'y', 'útil', 'glasman', 'y', 'glasman', '2010', 'estas', 'reuniones', 'entre', 'evaluador', 'y', 'evaluado', 'pueden', 'basarse', 'simplemente', 'en', 'una', 'lista', 'de', 'comprobación', 'que', 'examine', 'si', 'se', 'ha', 'demostrado', 'un', 'aspecto', 'de', 'la', 'evaluación', 'lashway', '2003']","['territorios', 'australia', 'bélgica', 'comunidad', 'francesa', 'provincias', 'territorios', 'canadá', 'chile', 'evaluación', 'desempeño', 'zelanda', 'ejemplo', 'queda', 'discreción', 'líderes', 'evaluadores', 'escolares', 'seleccionar', 'instrumentos', 'herramientas', 'recabar', 'información', 'dependiendo', 'aspectos', 'criterios', 'evaluación', 'elegidos', 'objetivos', 'desempeño', 'definidos', 'individualmente', 'instrumentos', 'fuentes', 'información', 'utilizados', 'reunir', 'pruebas', 'desempeño', 'líder', 'escolar', 'diferir', 'puestos', 'liderazgo', 'directores', 'escolares', 'subdirectores', 'escolares', 'costos', 'esfuerzos', 'requeridos', 'sopesarse', 'beneficios', 'múltiples', 'fuentes', 'información', 'esencial', 'reunir', 'cantidad', 'factible', 'información', 'precisa', 'válida', 'confiable', 'útil', 'glasman', 'glasman', '2010', 'reuniones', 'evaluador', 'evaluado', 'basarse', 'simplemente', 'lista', 'comprobación', 'examine', 'demostrado', 'aspecto', 'evaluación', 'lashway', '2003']","['territorio', 'australia', 'bélgico', 'comunidad', 'francés', 'provincia', 'territorio', 'canadá', 'chile', 'evaluación', 'desempeño', 'zelando', 'ejemplo', 'quedar', 'discreción', 'líder', 'evaluador', 'escolar', 'seleccionar', 'instrumento', 'herramienta', 'recabar', 'información', 'depender', 'aspecto', 'criterio', 'evaluación', 'elegido', 'objetivo', 'desempeño', 'definido', 'individualmente', 'instrumento', 'fuente', 'información', 'utilizado', 'reunir', 'prueba', 'desempeño', 'líder', 'escolar', 'diferir', 'puesto', 'liderazgo', 'director', 'escolar', 'subdirector', 'escolar', 'costo', 'esfuerzo', 'requerido', 'sopesar él', 'beneficio', 'múltiple', 'fuente', 'información', 'esencial', 'reunir', 'cantidad', 'factible', 'información', 'preciso', 'válido', 'confiable', 'útil', 'glasman', 'glasman', '2010', 'reunión', 'evaluador', 'evaluado', 'basar él', 'simplemente', 'listo', 'comprobación', 'examine', 'demostrado', 'aspecto', 'evaluación', 'lashway', '2003']",territorio australia bélgico comunidad francés provincia territorio canadá chile evaluación desempeño zelando ejemplo quedar discreción líder evaluador escolar seleccionar instrumento herramienta recabar información depender aspecto criterio evaluación elegido objetivo desempeño definido individualmente instrumento fuente información utilizado reunir prueba desempeño líder escolar diferir puesto liderazgo director escolar subdirector escolar costo esfuerzo requerido sopesar él beneficio múltiple fuente información esencial reunir cantidad factible información preciso válido confiable útil glasman glasman 2010 reunión evaluador evaluado basar él simplemente listo comprobación examine demostrado aspecto evaluación lashway 2003,4,4,4,ODS 4,ODS 4,ODS 4
la formación en el lugar de trabajo también debería estar sujeta a control de calidad en forma de arreglos contractuales inspecciones y autoevaluaciones invertir en una educación infantil temprana de alta calidad y en la escolarización inicial en particular para los niños de entornos socioeconómicamente desfavorecidos puede ser una estrategia eficaz para garantizar que los niños comiencen con fuerza sus carreras educativas y que las primeras habilidades generen futuras habilidades más adelante en la vida el apoyo financiero dirigido a estudiantes y escuelas desfavorecidos puede mejorar el desarrollo de habilidades los gobiernos pueden diseñar incentivos financieros y políticas fiscales favorables que alienten a las personas y los empleadores a invertir en educación y formación posobligatoria se puede alentar a las personas a asumir una mayor parte de la carga financiera de la educación terciaria mientras que a las personas desfavorecidas se les debe garantizar el acceso a las oportunidades educativas a través de subvenciones y préstamos si es necesario realizar recortes en el gasto público estos deben basarse en la relación costobeneficio a largo plazo de las inversiones públicas alternativas,"['la', 'formación', 'en', 'el', 'lugar', 'de', 'trabajo', 'también', 'debería', 'estar', 'sujeta', 'a', 'control', 'de', 'calidad', 'en', 'forma', 'de', 'arreglos', 'contractuales', 'inspecciones', 'y', 'autoevaluaciones', 'invertir', 'en', 'una', 'educación', 'infantil', 'temprana', 'de', 'alta', 'calidad', 'y', 'en', 'la', 'escolarización', 'inicial', 'en', 'particular', 'para', 'los', 'niños', 'de', 'entornos', 'socioeconómicamente', 'desfavorecidos', 'puede', 'ser', 'una', 'estrategia', 'eficaz', 'para', 'garantizar', 'que', 'los', 'niños', 'comiencen', 'con', 'fuerza', 'sus', 'carreras', 'educativas', 'y', 'que', 'las', 'primeras', 'habilidades', 'generen', 'futuras', 'habilidades', 'más', 'adelante', 'en', 'la', 'vida', 'el', 'apoyo', 'financiero', 'dirigido', 'a', 'estudiantes', 'y', 'escuelas', 'desfavorecidos', 'puede', 'mejorar', 'el', 'desarrollo', 'de', 'habilidades', 'los', 'gobiernos', 'pueden', 'diseñar', 'incentivos', 'financieros', 'y', 'políticas', 'fiscales', 'favorables', 'que', 'alienten', 'a', 'las', 'personas', 'y', 'los', 'empleadores', 'a', 'invertir', 'en', 'educación', 'y', 'formación', 'posobligatoria', 'se', 'puede', 'alentar', 'a', 'las', 'personas', 'a', 'asumir', 'una', 'mayor', 'parte', 'de', 'la', 'carga', 'financiera', 'de', 'la', 'educación', 'terciaria', 'mientras', 'que', 'a', 'las', 'personas', 'desfavorecidas', 'se', 'les', 'debe', 'garantizar', 'el', 'acceso', 'a', 'las', 'oportunidades', 'educativas', 'a', 'través', 'de', 'subvenciones', 'y', 'préstamos', 'si', 'es', 'necesario', 'realizar', 'recortes', 'en', 'el', 'gasto', 'público', 'estos', 'deben', 'basarse', 'en', 'la', 'relación', 'costobeneficio', 'a', 'largo', 'plazo', 'de', 'las', 'inversiones', 'públicas', 'alternativas']","['formación', 'lugar', 'trabajo', 'debería', 'sujeta', 'control', 'calidad', 'forma', 'arreglos', 'contractuales', 'inspecciones', 'autoevaluaciones', 'invertir', 'educación', 'infantil', 'temprana', 'alta', 'calidad', 'escolarización', 'inicial', 'particular', 'niños', 'entornos', 'socioeconómicamente', 'desfavorecidos', 'estrategia', 'eficaz', 'garantizar', 'niños', 'comiencen', 'fuerza', 'carreras', 'educativas', 'primeras', 'habilidades', 'generen', 'futuras', 'habilidades', 'vida', 'apoyo', 'financiero', 'dirigido', 'estudiantes', 'escuelas', 'desfavorecidos', 'mejorar', 'desarrollo', 'habilidades', 'gobiernos', 'diseñar', 'incentivos', 'financieros', 'políticas', 'fiscales', 'favorables', 'alienten', 'personas', 'empleadores', 'invertir', 'educación', 'formación', 'posobligatoria', 'alentar', 'personas', 'asumir', 'carga', 'financiera', 'educación', 'terciaria', 'personas', 'desfavorecidas', 'garantizar', 'acceso', 'oportunidades', 'educativas', 'subvenciones', 'préstamos', 'necesario', 'recortes', 'gasto', 'público', 'basarse', 'relación', 'costobeneficio', 'plazo', 'inversiones', 'públicas', 'alternativas']","['formación', 'lugar', 'trabajo', 'deber', 'sujeta', 'control', 'calidad', 'formar', 'arreglo', 'contractual', 'inspección', 'autoevaluación', 'invertir', 'educación', 'infantil', 'temprano', 'alto', 'calidad', 'escolarización', 'inicial', 'particular', 'niño', 'entorno', 'socioeconómicamente', 'desfavorecido', 'estrategia', 'eficaz', 'garantizar', 'niño', 'comiencir', 'fuerza', 'carrera', 'educativo', 'primero', 'habilidad', 'generar', 'futuro', 'habilidad', 'vido', 'apoyo', 'financiero', 'dirigido', 'estudiante', 'escuela', 'desfavorecido', 'mejorar', 'desarrollo', 'habilidades', 'gobierno', 'diseñar', 'incentivo', 'financiero', 'política', 'fiscal', 'favorable', 'alentar', 'persona', 'empleador', 'invertir', 'educación', 'formación', 'posobligatorio', 'alentar', 'persona', 'asumir', 'carga', 'financiero', 'educación', 'terciario', 'persona', 'desfavorecido', 'garantizar', 'acceso', 'oportunidad', 'educativo', 'subvención', 'préstamo', 'necesario', 'recorte', 'gasto', 'público', 'basar él', 'relación', 'costobeneficio', 'plazo', 'inversión', 'público', 'alternativo']",formación lugar trabajo deber sujeta control calidad formar arreglo contractual inspección autoevaluación invertir educación infantil temprano alto calidad escolarización inicial particular niño entorno socioeconómicamente desfavorecido estrategia eficaz garantizar niño comiencir fuerza carrera educativo primero habilidad generar futuro habilidad vido apoyo financiero dirigido estudiante escuela desfavorecido mejorar desarrollo habilidades gobierno diseñar incentivo financiero política fiscal favorable alentar persona empleador invertir educación formación posobligatorio alentar persona asumir carga financiero educación terciario persona desfavorecido garantizar acceso oportunidad educativo subvención préstamo necesario recorte gasto público basar él relación costobeneficio plazo inversión público alternativo,4,4,4,ODS 4,ODS 4,ODS 4
estos adultos necesitan una formación ajustada a sus intereses y a sus competencias previamente adquiridas por último las empresas competitivas que desean mejorar las competencias de su personal representan otro grupo de usuarios muy exigente un rápido vistazo a las cifras muestra que los centros de fp i también ofrecen formación a grupos no tradicionales la tabla 86 recoge estadísticas oficiales del sapte que podrían no incluir la formación no reglada que se imparte en algunos centros de fp y algunas asociaciones poco frecuentes con autoridades locales y ong en el marco de proyectos patrocinados por donantes internacionales,"['estos', 'adultos', 'necesitan', 'una', 'formación', 'ajustada', 'a', 'sus', 'intereses', 'y', 'a', 'sus', 'competencias', 'previamente', 'adquiridas', 'por', 'último', 'las', 'empresas', 'competitivas', 'que', 'desean', 'mejorar', 'las', 'competencias', 'de', 'su', 'personal', 'representan', 'otro', 'grupo', 'de', 'usuarios', 'muy', 'exigente', 'un', 'rápido', 'vistazo', 'a', 'las', 'cifras', 'muestra', 'que', 'los', 'centros', 'de', 'fp', 'i', 'también', 'ofrecen', 'formación', 'a', 'grupos', 'no', 'tradicionales', 'la', 'tabla', '86', 'recoge', 'estadísticas', 'oficiales', 'del', 'sapte', 'que', 'podrían', 'no', 'incluir', 'la', 'formación', 'no', 'reglada', 'que', 'se', 'imparte', 'en', 'algunos', 'centros', 'de', 'fp', 'y', 'algunas', 'asociaciones', 'poco', 'frecuentes', 'con', 'autoridades', 'locales', 'y', 'ong', 'en', 'el', 'marco', 'de', 'proyectos', 'patrocinados', 'por', 'donantes', 'internacionales']","['adultos', 'necesitan', 'formación', 'ajustada', 'intereses', 'competencias', 'previamente', 'adquiridas', 'empresas', 'competitivas', 'desean', 'mejorar', 'competencias', 'personal', 'representan', 'grupo', 'usuarios', 'exigente', 'rápido', 'vistazo', 'cifras', 'muestra', 'centros', 'fp', 'i', 'ofrecen', 'formación', 'grupos', 'tradicionales', 'tabla', '86', 'recoge', 'estadísticas', 'oficiales', 'sapte', 'incluir', 'formación', 'reglada', 'imparte', 'centros', 'fp', 'asociaciones', 'frecuentes', 'autoridades', 'locales', 'ong', 'marco', 'proyectos', 'patrocinados', 'donantes', 'internacionales']","['adulto', 'necesitar', 'formación', 'ajustado', 'interés', 'competencia', 'previamente', 'adquirido', 'empresa', 'competitivo', 'desear', 'mejorar', 'competencia', 'personal', 'representar', 'grupo', 'usuario', 'exigente', 'rápido', 'vistazo', 'cifra', 'mostrar', 'centro', 'fp', 'i', 'ofrecer', 'formación', 'grupo', 'tradicional', 'tabla', '86', 'recoger', 'estadística', 'oficial', 'sapte', 'incluir', 'formación', 'reglado', 'imparte', 'centro', 'fp', 'asociación', 'frecuente', 'autoridad', 'local', 'ong', 'marco', 'proyecto', 'patrocinado', 'donante', 'internacional']",adulto necesitar formación ajustado interés competencia previamente adquirido empresa competitivo desear mejorar competencia personal representar grupo usuario exigente rápido vistazo cifra mostrar centro fp i ofrecer formación grupo tradicional tabla 86 recoger estadística oficial sapte incluir formación reglado imparte centro fp asociación frecuente autoridad local ong marco proyecto patrocinado donante internacional,4,4,4,ODS 4,ODS 4,ODS 4
los grupos exitosos lograron reducir las tasas de pobreza de más del 80 en la década de 1980 a cerca del 44 en 2007 mientras que para los países rezagados la tasa de pobreza total se ha mantenido muy por encima del 70 durante todo el período tanto la tasa de incidencia como el número de pobres en este grupo de países se redujeron durante este período su participación aumentó de aproximadamente el 13 al 18 de la población total entre principios de la década de 1980 y 2007 mientras que el porcentaje de su población que vive con menos de 2 al día aumentó de aproximadamente el 16 a más del 30,"['los', 'grupos', 'exitosos', 'lograron', 'reducir', 'las', 'tasas', 'de', 'pobreza', 'de', 'más', 'del', '80', 'en', 'la', 'década', 'de', '1980', 'a', 'cerca', 'del', '44', 'en', '2007', 'mientras', 'que', 'para', 'los', 'países', 'rezagados', 'la', 'tasa', 'de', 'pobreza', 'total', 'se', 'ha', 'mantenido', 'muy', 'por', 'encima', 'del', '70', 'durante', 'todo', 'el', 'período', 'tanto', 'la', 'tasa', 'de', 'incidencia', 'como', 'el', 'número', 'de', 'pobres', 'en', 'este', 'grupo', 'de', 'países', 'se', 'redujeron', 'durante', 'este', 'período', 'su', 'participación', 'aumentó', 'de', 'aproximadamente', 'el', '13', 'al', '18', 'de', 'la', 'población', 'total', 'entre', 'principios', 'de', 'la', 'década', 'de', '1980', 'y', '2007', 'mientras', 'que', 'el', 'porcentaje', 'de', 'su', 'población', 'que', 'vive', 'con', 'menos', 'de', '2', 'al', 'día', 'aumentó', 'de', 'aproximadamente', 'el', '16', 'a', 'más', 'del', '30']","['grupos', 'exitosos', 'lograron', 'reducir', 'tasas', 'pobreza', '80', 'década', '1980', 'cerca', '44', '2007', 'países', 'rezagados', 'tasa', 'pobreza', 'mantenido', '70', 'período', 'tasa', 'incidencia', 'número', 'pobres', 'grupo', 'países', 'redujeron', 'período', 'participación', 'aumentó', '13', '18', 'población', 'principios', 'década', '1980', '2007', 'porcentaje', 'población', 'vive', '2', 'aumentó', '16', '30']","['grupo', 'exitoso', 'lograr', 'reducir', 'tasa', 'pobreza', '80', 'década', '1980', 'cerca', '44', '2007', 'país', 'rezagado', 'tasa', 'pobrezar', 'mantenido', '70', 'período', 'tasar', 'incidencia', 'número', 'pobre', 'grupo', 'país', 'reducir', 'período', 'participación', 'aumentar', '13', '18', 'población', 'principio', 'décado', '1980', '2007', 'porcentaje', 'población', 'vivir', '2', 'aumentar', '16', '30']",grupo exitoso lograr reducir tasa pobreza 80 década 1980 cerca 44 2007 país rezagado tasa pobrezar mantenido 70 período tasar incidencia número pobre grupo país reducir período participación aumentar 13 18 población principio décado 1980 2007 porcentaje población vivir 2 aumentar 16 30,1,1,1,ODS 1,ODS 1,ODS 1
jane chapman asesora independiente de riesgos del tavistock and portman nhs trust llevó a cabo una exhaustiva evaluación de la gobernanza y los riesgos de big white wall la evaluación mostró que bww conlleva un riesgo global bajo para los usuarios dadas las salvaguardias existentes esto podría indicar las diferentes direcciones que están tomando los países en el desarrollo y las prioridades de sus sistemas de salud mental en noruega donde se percibe una escasez de psicólogos y en particular de enfermeros y psicólogos en las escuelas el ministerio de sanidad y servicios sanitarios ha financiado directamente un aumento del número de psicólogos que trabajan en los municipios,"['jane', 'chapman', 'asesora', 'independiente', 'de', 'riesgos', 'del', 'tavistock', 'and', 'portman', 'nhs', 'trust', 'llevó', 'a', 'cabo', 'una', 'exhaustiva', 'evaluación', 'de', 'la', 'gobernanza', 'y', 'los', 'riesgos', 'de', 'big', 'white', 'wall', 'la', 'evaluación', 'mostró', 'que', 'bww', 'conlleva', 'un', 'riesgo', 'global', 'bajo', 'para', 'los', 'usuarios', 'dadas', 'las', 'salvaguardias', 'existentes', 'esto', 'podría', 'indicar', 'las', 'diferentes', 'direcciones', 'que', 'están', 'tomando', 'los', 'países', 'en', 'el', 'desarrollo', 'y', 'las', 'prioridades', 'de', 'sus', 'sistemas', 'de', 'salud', 'mental', 'en', 'noruega', 'donde', 'se', 'percibe', 'una', 'escasez', 'de', 'psicólogos', 'y', 'en', 'particular', 'de', 'enfermeros', 'y', 'psicólogos', 'en', 'las', 'escuelas', 'el', 'ministerio', 'de', 'sanidad', 'y', 'servicios', 'sanitarios', 'ha', 'financiado', 'directamente', 'un', 'aumento', 'del', 'número', 'de', 'psicólogos', 'que', 'trabajan', 'en', 'los', 'municipios']","['jane', 'chapman', 'asesora', 'independiente', 'riesgos', 'tavistock', 'and', 'portman', 'nhs', 'trust', 'llevó', 'cabo', 'exhaustiva', 'evaluación', 'gobernanza', 'riesgos', 'big', 'white', 'wall', 'evaluación', 'mostró', 'bww', 'conlleva', 'riesgo', 'global', 'usuarios', 'dadas', 'salvaguardias', 'existentes', 'indicar', 'direcciones', 'tomando', 'países', 'desarrollo', 'prioridades', 'sistemas', 'salud', 'mental', 'noruega', 'percibe', 'escasez', 'psicólogos', 'particular', 'enfermeros', 'psicólogos', 'escuelas', 'ministerio', 'sanidad', 'servicios', 'sanitarios', 'financiado', 'directamente', 'aumento', 'número', 'psicólogos', 'trabajan', 'municipios']","['jane', 'chapman', 'asesora', 'independiente', 'riesgo', 'tavistock', 'and', 'portmar', 'nhs', 'trust', 'llevar', 'cabo', 'exhaustivo', 'evaluación', 'gobernanza', 'riesgo', 'big', 'white', 'wall', 'evaluación', 'mostrar', 'bww', 'conllevar', 'riesgo', 'global', 'usuario', 'dado', 'salvaguardia', 'existente', 'indicar', 'dirección', 'tomar', 'país', 'desarrollo', 'prioridad', 'sistema', 'salud', 'mental', 'noruego', 'percibir', 'escasez', 'psicólogo', 'particular', 'enfermero', 'psicólogo', 'escuelas', 'ministerio', 'sanidad', 'servicio', 'sanitario', 'financiado', 'directamente', 'aumento', 'número', 'psicólogo', 'trabajar', 'municipio']",jane chapman asesora independiente riesgo tavistock and portmar nhs trust llevar cabo exhaustivo evaluación gobernanza riesgo big white wall evaluación mostrar bww conllevar riesgo global usuario dado salvaguardia existente indicar dirección tomar país desarrollo prioridad sistema salud mental noruego percibir escasez psicólogo particular enfermero psicólogo escuelas ministerio sanidad servicio sanitario financiado directamente aumento número psicólogo trabajar municipio,3,3,3,ODS 3,ODS 3,ODS 3
el reto futuro del sns es ser capaz de mantener la motivación de su plantilla y contener e invertir la fuga de profesionales sin embargo no es probable que el escaso número de enfermeros aumente en un futuro próximo mientras que el número de licenciados en medicina ha aumentado de forma constante a lo largo del tiempo el número de licenciados en enfermería ha ido disminuyendo desde 2009 en particular las mejoras sanitarias y el aumento de la actividad en el sns se obtuvieron sin recursos adicionales lo que indica tanto una mejora de la relación calidad-precio como la existencia de grandes ineficiencias en el sistema,"['el', 'reto', 'futuro', 'del', 'sns', 'es', 'ser', 'capaz', 'de', 'mantener', 'la', 'motivación', 'de', 'su', 'plantilla', 'y', 'contener', 'e', 'invertir', 'la', 'fuga', 'de', 'profesionales', 'sin', 'embargo', 'no', 'es', 'probable', 'que', 'el', 'escaso', 'número', 'de', 'enfermeros', 'aumente', 'en', 'un', 'futuro', 'próximo', 'mientras', 'que', 'el', 'número', 'de', 'licenciados', 'en', 'medicina', 'ha', 'aumentado', 'de', 'forma', 'constante', 'a', 'lo', 'largo', 'del', 'tiempo', 'el', 'número', 'de', 'licenciados', 'en', 'enfermería', 'ha', 'ido', 'disminuyendo', 'desde', '2009', 'en', 'particular', 'las', 'mejoras', 'sanitarias', 'y', 'el', 'aumento', 'de', 'la', 'actividad', 'en', 'el', 'sns', 'se', 'obtuvieron', 'sin', 'recursos', 'adicionales', 'lo', 'que', 'indica', 'tanto', 'una', 'mejora', 'de', 'la', 'relación', 'calidad-precio', 'como', 'la', 'existencia', 'de', 'grandes', 'ineficiencias', 'en', 'el', 'sistema']","['reto', 'futuro', 'sns', 'capaz', 'mantener', 'motivación', 'plantilla', 'contener', 'invertir', 'fuga', 'profesionales', 'probable', 'escaso', 'número', 'enfermeros', 'aumente', 'futuro', 'número', 'licenciados', 'medicina', 'aumentado', 'forma', 'constante', 'tiempo', 'número', 'licenciados', 'enfermería', 'ido', 'disminuyendo', '2009', 'particular', 'mejoras', 'sanitarias', 'aumento', 'actividad', 'sns', 'obtuvieron', 'recursos', 'adicionales', 'indica', 'mejora', 'relación', 'calidad-precio', 'existencia', 'ineficiencias', 'sistema']","['reto', 'futuro', 'sns', 'capaz', 'mantener', 'motivación', 'plantillo', 'contener', 'invertir', 'fuga', 'profesional', 'probable', 'escaso', 'número', 'enfermero', 'aumentar', 'futuro', 'número', 'licenciado', 'medicinar', 'aumentado', 'forma', 'constante', 'tiempo', 'número', 'licenciado', 'enfermeer', 'ido', 'disminuir', '2009', 'particular', 'mejora', 'sanitario', 'aumento', 'actividad', 'sns', 'obtener', 'recurso', 'adicional', 'indicar', 'mejora', 'relación', 'calidad-precio', 'existencia', 'ineficiencia', 'sistema']",reto futuro sns capaz mantener motivación plantillo contener invertir fuga profesional probable escaso número enfermero aumentar futuro número licenciado medicinar aumentado forma constante tiempo número licenciado enfermeer ido disminuir 2009 particular mejora sanitario aumento actividad sns obtener recurso adicional indicar mejora relación calidad-precio existencia ineficiencia sistema,3,3,3,ODS 3,ODS 3,ODS 3
