textos,tokens,tokens_sin_innecesarios,lematizados,lematizados_str,pred_KNN,pred_RedNeuronal,pred_SVM,pred_SVM_ODS,pred_KNN_ODS,pred_RedNeuronal_ODS
la comisión ha subrayado recientemente la importancia de la educación y los conocimientos sanitarios para mejorar los resultados sanitarios a lo largo de la vida con especial atención a los adolescentes y los jóvenes las resoluciones sobre determinados grupos de población como los emigrantes los adolescentes y jóvenes las personas mayores o los residentes urbanos y rurales han reconocido las necesidades sanitarias de esos grupos y las implicaciones conexas para los sistemas de salud las resoluciones también han llamado la atención sobre los efectos negativos de la emigración de trabajadores altamente cualificados en el desarrollo de los países de origen a menudo en los sectores relacionados con la salud y han pedido una contratación ética de los trabajadores sanitarios,"['la', 'comisión', 'ha', 'subrayado', 'recientemente', 'la', 'importancia', 'de', 'la', 'educación', 'y', 'los', 'conocimientos', 'sanitarios', 'para', 'mejorar', 'los', 'resultados', 'sanitarios', 'a', 'lo', 'largo', 'de', 'la', 'vida', 'con', 'especial', 'atención', 'a', 'los', 'adolescentes', 'y', 'los', 'jóvenes', 'las', 'resoluciones', 'sobre', 'determinados', 'grupos', 'de', 'población', 'como', 'los', 'emigrantes', 'los', 'adolescentes', 'y', 'jóvenes', 'las', 'personas', 'mayores', 'o', 'los', 'residentes', 'urbanos', 'y', 'rurales', 'han', 'reconocido', 'las', 'necesidades', 'sanitarias', 'de', 'esos', 'grupos', 'y', 'las', 'implicaciones', 'conexas', 'para', 'los', 'sistemas', 'de', 'salud', 'las', 'resoluciones', 'también', 'han', 'llamado', 'la', 'atención', 'sobre', 'los', 'efectos', 'negativos', 'de', 'la', 'emigración', 'de', 'trabajadores', 'altamente', 'cualificados', 'en', 'el', 'desarrollo', 'de', 'los', 'países', 'de', 'origen', 'a', 'menudo', 'en', 'los', 'sectores', 'relacionados', 'con', 'la', 'salud', 'y', 'han', 'pedido', 'una', 'contratación', 'ética', 'de', 'los', 'trabajadores', 'sanitarios']","['comisión', 'subrayado', 'recientemente', 'importancia', 'educación', 'conocimientos', 'sanitarios', 'mejorar', 'resultados', 'sanitarios', 'vida', 'especial', 'atención', 'adolescentes', 'jóvenes', 'resoluciones', 'determinados', 'grupos', 'población', 'emigrantes', 'adolescentes', 'jóvenes', 'personas', 'mayores', 'residentes', 'urbanos', 'rurales', 'reconocido', 'necesidades', 'sanitarias', 'grupos', 'implicaciones', 'conexas', 'sistemas', 'salud', 'resoluciones', 'llamado', 'atención', 'efectos', 'negativos', 'emigración', 'trabajadores', 'altamente', 'cualificados', 'desarrollo', 'países', 'origen', 'sectores', 'relacionados', 'salud', 'pedido', 'contratación', 'ética', 'trabajadores', 'sanitarios']","['comisión', 'subrayado', 'recientemente', 'importancia', 'educación', 'conocimiento', 'sanitario', 'mejorar', 'resultado', 'sanitario', 'vida', 'especial', 'atención', 'adolescente', 'joven', 'resolución', 'determinado', 'grupo', 'población', 'emigrant', 'adolescente', 'joven', 'persona', 'mayor', 'residente', 'urbano', 'rural', 'reconocido', 'necesidad', 'sanitario', 'grupo', 'implicación', 'conexa', 'sistema', 'salud', 'resolución', 'llamado', 'atención', 'efecto', 'negativo', 'emigración', 'trabajador', 'altamente', 'cualificado', 'desarrollo', 'país', 'origen', 'sector', 'relacionado', 'salud', 'pedido', 'contratación', 'ético', 'trabajador', 'sanitario']",comisión subrayado recientemente importancia educación conocimiento sanitario mejorar resultado sanitario vida especial atención adolescente joven resolución determinado grupo población emigrant adolescente joven persona mayor residente urbano rural reconocido necesidad sanitario grupo implicación conexa sistema salud resolución llamado atención efecto negativo emigración trabajador altamente cualificado desarrollo país origen sector relacionado salud pedido contratación ético trabajador sanitario,3,3,3,ODS 3,ODS 3,ODS 3
la atención primaria no basta por sí sola para lograr el impacto necesario para mejorar la salud urbana además de la atención primaria las políticas y la legislación pertinente deben prestar la debida atención a cuestiones más amplias de salud pública la asignación presupuestaria para los servicios de salud pública debería aumentarse del 4 actual al 8 como se ha hecho en los países vecinos,"['la', 'atención', 'primaria', 'no', 'basta', 'por', 'sí', 'sola', 'para', 'lograr', 'el', 'impacto', 'necesario', 'para', 'mejorar', 'la', 'salud', 'urbana', 'además', 'de', 'la', 'atención', 'primaria', 'las', 'políticas', 'y', 'la', 'legislación', 'pertinente', 'deben', 'prestar', 'la', 'debida', 'atención', 'a', 'cuestiones', 'más', 'amplias', 'de', 'salud', 'pública', 'la', 'asignación', 'presupuestaria', 'para', 'los', 'servicios', 'de', 'salud', 'pública', 'debería', 'aumentarse', 'del', '4', 'actual', 'al', '8', 'como', 'se', 'ha', 'hecho', 'en', 'los', 'países', 'vecinos']","['atención', 'primaria', 'basta', 'lograr', 'impacto', 'necesario', 'mejorar', 'salud', 'urbana', 'atención', 'primaria', 'políticas', 'legislación', 'pertinente', 'prestar', 'debida', 'atención', 'cuestiones', 'amplias', 'salud', 'pública', 'asignación', 'presupuestaria', 'servicios', 'salud', 'pública', 'debería', 'aumentarse', '4', 'actual', '8', 'países', 'vecinos']","['atención', 'primario', 'bastar', 'lograr', 'impacto', 'necesario', 'mejorar', 'salud', 'urbano', 'atención', 'primario', 'política', 'legislación', 'pertinente', 'prestar', 'debido', 'atención', 'cuestión', 'amplio', 'salud', 'público', 'asignación', 'presupuestario', 'servicio', 'salud', 'público', 'deber', 'aumentar él', '4', 'actual', '8', 'país', 'vecino']",atención primario bastar lograr impacto necesario mejorar salud urbano atención primario política legislación pertinente prestar debido atención cuestión amplio salud público asignación presupuestario servicio salud público deber aumentar él 4 actual 8 país vecino,3,3,3,ODS 3,ODS 3,ODS 3
el capítulo revisa las políticas sociales existentes y los intentos recientes de encontrar mejores formas de asignar los recursos públicos a los más necesitados en particular las familias con niños concluye con un resumen de los principales desafíos y sugiere vías de reforma para desarrollar un sistema de protección social que apoyaría a la población en edad de trabajar de manera más efectiva la fuerte desaceleración económica subsiguiente en 2009 no generó un aumento significativo en las tasas generales de pobreza ya que los ajustes del mercado laboral implicaron una reducción de las horas de trabajo en lugar de despidos capítulo 1 y porque los pagos de pensiones aumentaron casi un 50 desde 2007 capítulo 4,"['el', 'capítulo', 'revisa', 'las', 'políticas', 'sociales', 'existentes', 'y', 'los', 'intentos', 'recientes', 'de', 'encontrar', 'mejores', 'formas', 'de', 'asignar', 'los', 'recursos', 'públicos', 'a', 'los', 'más', 'necesitados', 'en', 'particular', 'las', 'familias', 'con', 'niños', 'concluye', 'con', 'un', 'resumen', 'de', 'los', 'principales', 'desafíos', 'y', 'sugiere', 'vías', 'de', 'reforma', 'para', 'desarrollar', 'un', 'sistema', 'de', 'protección', 'social', 'que', 'apoyaría', 'a', 'la', 'población', 'en', 'edad', 'de', 'trabajar', 'de', 'manera', 'más', 'efectiva', 'la', 'fuerte', 'desaceleración', 'económica', 'subsiguiente', 'en', '2009', 'no', 'generó', 'un', 'aumento', 'significativo', 'en', 'las', 'tasas', 'generales', 'de', 'pobreza', 'ya', 'que', 'los', 'ajustes', 'del', 'mercado', 'laboral', 'implicaron', 'una', 'reducción', 'de', 'las', 'horas', 'de', 'trabajo', 'en', 'lugar', 'de', 'despidos', 'capítulo', '1', 'y', 'porque', 'los', 'pagos', 'de', 'pensiones', 'aumentaron', 'casi', 'un', '50', 'desde', '2007', 'capítulo', '4']","['capítulo', 'revisa', 'políticas', 'sociales', 'existentes', 'intentos', 'recientes', 'encontrar', 'mejores', 'formas', 'asignar', 'recursos', 'públicos', 'necesitados', 'particular', 'familias', 'niños', 'concluye', 'resumen', 'principales', 'desafíos', 'sugiere', 'vías', 'reforma', 'desarrollar', 'sistema', 'protección', 'social', 'apoyaría', 'población', 'edad', 'trabajar', 'efectiva', 'fuerte', 'desaceleración', 'económica', 'subsiguiente', '2009', 'generó', 'aumento', 'significativo', 'tasas', 'generales', 'pobreza', 'ajustes', 'mercado', 'laboral', 'implicaron', 'reducción', 'horas', 'trabajo', 'lugar', 'despidos', 'capítulo', '1', 'pagos', 'pensiones', 'aumentaron', '50', '2007', 'capítulo', '4']","['capítulo', 'revisa', 'política', 'social', 'existente', 'intento', 'reciente', 'encontrar', 'mejor', 'forma', 'asignar', 'recurso', 'público', 'necesitado', 'particular', 'familia', 'niño', 'concluir', 'resumir', 'principal', 'desafío', 'sugerir', 'vía', 'reforma', 'desarrollar', 'sistema', 'protección', 'social', 'apoyar', 'población', 'edad', 'trabajar', 'efectivo', 'fuerte', 'desaceleración', 'económico', 'subsiguiente', '2009', 'generar', 'aumento', 'significativo', 'tasa', 'general', 'pobrezar', 'ajuste', 'mercado', 'laboral', 'implicar', 'reducción', 'hora', 'trabajar', 'lugar', 'despido', 'capítulo', '1', 'pago', 'pensión', 'aumentar', '50', '2007', 'capítulo', '4']",capítulo revisa política social existente intento reciente encontrar mejor forma asignar recurso público necesitado particular familia niño concluir resumir principal desafío sugerir vía reforma desarrollar sistema protección social apoyar población edad trabajar efectivo fuerte desaceleración económico subsiguiente 2009 generar aumento significativo tasa general pobrezar ajuste mercado laboral implicar reducción hora trabajar lugar despido capítulo 1 pago pensión aumentar 50 2007 capítulo 4,1,1,1,ODS 1,ODS 1,ODS 1
si bien el control del vihsida y de las enfermedades infecciosas absorbió alrededor del 20 de los compromisos de aod en la década de 1990 12 y 8 respectivamente estos programas representaron el 51 de todos los compromisos en 2005-2006 35 y 16 respectivamente en primer lugar la lucha contra determinadas enfermedades especialmente las enfermedades contagiosas es un bien público global y por tanto requiere respuestas globales y eficaces en segundo lugar centrarse en una enfermedad específica puede movilizar la opinión pública y los recursos de una forma más eficaz,"['si', 'bien', 'el', 'control', 'del', 'vihsida', 'y', 'de', 'las', 'enfermedades', 'infecciosas', 'absorbió', 'alrededor', 'del', '20', 'de', 'los', 'compromisos', 'de', 'aod', 'en', 'la', 'década', 'de', '1990', '12', 'y', '8', 'respectivamente', 'estos', 'programas', 'representaron', 'el', '51', 'de', 'todos', 'los', 'compromisos', 'en', '2005-2006', '35', 'y', '16', 'respectivamente', 'en', 'primer', 'lugar', 'la', 'lucha', 'contra', 'determinadas', 'enfermedades', 'especialmente', 'las', 'enfermedades', 'contagiosas', 'es', 'un', 'bien', 'público', 'global', 'y', 'por', 'tanto', 'requiere', 'respuestas', 'globales', 'y', 'eficaces', 'en', 'segundo', 'lugar', 'centrarse', 'en', 'una', 'enfermedad', 'específica', 'puede', 'movilizar', 'la', 'opinión', 'pública', 'y', 'los', 'recursos', 'de', 'una', 'forma', 'más', 'eficaz']","['control', 'vihsida', 'enfermedades', 'infecciosas', 'absorbió', '20', 'compromisos', 'aod', 'década', '1990', '12', '8', 'respectivamente', 'programas', 'representaron', '51', 'compromisos', '2005-2006', '35', '16', 'respectivamente', 'lugar', 'lucha', 'determinadas', 'enfermedades', 'especialmente', 'enfermedades', 'contagiosas', 'público', 'global', 'requiere', 'respuestas', 'globales', 'eficaces', 'lugar', 'centrarse', 'enfermedad', 'específica', 'movilizar', 'opinión', 'pública', 'recursos', 'forma', 'eficaz']","['control', 'vihsido', 'enfermedad', 'infeccioso', 'absorber', '20', 'compromiso', 'aod', 'décado', '1990', '12', '8', 'respectivamente', 'programa', 'representar', '51', 'compromiso', '2005-2006', '35', '16', 'respectivamente', 'lugar', 'luchar', 'determinado', 'enfermedad', 'especialmente', 'enfermedad', 'contagiosa', 'público', 'global', 'requerir', 'respuesta', 'global', 'eficaz', 'lugar', 'centrar él', 'enfermedad', 'específico', 'movilizar', 'opinión', 'público', 'recurso', 'forma', 'eficaz']",control vihsido enfermedad infeccioso absorber 20 compromiso aod décado 1990 12 8 respectivamente programa representar 51 compromiso 2005-2006 35 16 respectivamente lugar luchar determinado enfermedad especialmente enfermedad contagiosa público global requerir respuesta global eficaz lugar centrar él enfermedad específico movilizar opinión público recurso forma eficaz,3,3,3,ODS 3,ODS 3,ODS 3
para estimar la carga financiera de los eda en alemania stark et al 2011 basaron el estudio de costes en un modelo procedente del sistema sanitario estadounidense sus estimaciones cuantificaron en 816 millones de euros los costes de la asistencia sanitaria relacionados con los eda surgidos en entornos de asistencia ambulatoria es decir el 022 del gasto sanitario alemán en 2011 casi el 60 se debió a hospitalizaciones el 11 a visitas a urgencias y el 21 restante a gastos realizados en cuidados de larga duración sin embargo estos costes son solo aproximaciones,"['para', 'estimar', 'la', 'carga', 'financiera', 'de', 'los', 'eda', 'en', 'alemania', 'stark', 'et', 'al', '2011', 'basaron', 'el', 'estudio', 'de', 'costes', 'en', 'un', 'modelo', 'procedente', 'del', 'sistema', 'sanitario', 'estadounidense', 'sus', 'estimaciones', 'cuantificaron', 'en', '816', 'millones', 'de', 'euros', 'los', 'costes', 'de', 'la', 'asistencia', 'sanitaria', 'relacionados', 'con', 'los', 'eda', 'surgidos', 'en', 'entornos', 'de', 'asistencia', 'ambulatoria', 'es', 'decir', 'el', '022', 'del', 'gasto', 'sanitario', 'alemán', 'en', '2011', 'casi', 'el', '60', 'se', 'debió', 'a', 'hospitalizaciones', 'el', '11', 'a', 'visitas', 'a', 'urgencias', 'y', 'el', '21', 'restante', 'a', 'gastos', 'realizados', 'en', 'cuidados', 'de', 'larga', 'duración', 'sin', 'embargo', 'estos', 'costes', 'son', 'solo', 'aproximaciones']","['estimar', 'carga', 'financiera', 'eda', 'alemania', 'stark', 'et', '2011', 'basaron', 'estudio', 'costes', 'modelo', 'procedente', 'sistema', 'sanitario', 'estadounidense', 'estimaciones', 'cuantificaron', '816', 'millones', 'euros', 'costes', 'asistencia', 'sanitaria', 'relacionados', 'eda', 'surgidos', 'entornos', 'asistencia', 'ambulatoria', '022', 'gasto', 'sanitario', 'alemán', '2011', '60', 'debió', 'hospitalizaciones', '11', 'visitas', 'urgencias', '21', 'restante', 'gastos', 'realizados', 'cuidados', 'larga', 'duración', 'costes', 'aproximaciones']","['estimar', 'carga', 'financiero', 'edo', 'alemania', 'stark', 'et', '2011', 'basar', 'estudio', 'cost', 'modelo', 'procedente', 'sistema', 'sanitario', 'estadounidense', 'estimación', 'cuantificar', '816', 'millón', 'euros', 'coste', 'asistencia', 'sanitario', 'relacionado', 'edo', 'surgido', 'entorno', 'asistencia', 'ambulatorio', '022', 'gasto', 'sanitario', 'alemán', '2011', '60', 'deber', 'hospitalización', '11', 'visita', 'urgencia', '21', 'restante', 'gasto', 'realizado', 'cuidado', 'largo', 'duración', 'coste', 'aproximación']",estimar carga financiero edo alemania stark et 2011 basar estudio cost modelo procedente sistema sanitario estadounidense estimación cuantificar 816 millón euros coste asistencia sanitario relacionado edo surgido entorno asistencia ambulatorio 022 gasto sanitario alemán 2011 60 deber hospitalización 11 visita urgencia 21 restante gasto realizado cuidado largo duración coste aproximación,3,3,3,ODS 3,ODS 3,ODS 3
además de caracterizar el estado de la población por ejemplo al realizar las evaluaciones económicas de las intervenciones de control del cáncer pohem suele utilizar una muestra de simulación de un millón de individuos y reúne información sobre los factores de riesgo la incidencia de la enfermedad por edad sexo y tipo de célula la distribución por estadios en el momento del diagnóstico y los enfoques diagnósticos y terapéuticos estándar o típicos utilizados además se requieren datos sobre la progresión de la enfermedad tras el diagnóstico inicial en función de la edad el sexo y el estadio en el momento del diagnóstico además de las pautas de seguimiento de la práctica el tratamiento en la recaída y los cuidados terminales por lo tanto se utilizan 23 conjuntos de datos diferentes que incluyen diversos registros de cáncer y registros hospitalarios datos de asociaciones farmacéuticas encuestas de salud de la población estudios de cribado y ensayos clínicos etc,"['además', 'de', 'caracterizar', 'el', 'estado', 'de', 'la', 'población', 'por', 'ejemplo', 'al', 'realizar', 'las', 'evaluaciones', 'económicas', 'de', 'las', 'intervenciones', 'de', 'control', 'del', 'cáncer', 'pohem', 'suele', 'utilizar', 'una', 'muestra', 'de', 'simulación', 'de', 'un', 'millón', 'de', 'individuos', 'y', 'reúne', 'información', 'sobre', 'los', 'factores', 'de', 'riesgo', 'la', 'incidencia', 'de', 'la', 'enfermedad', 'por', 'edad', 'sexo', 'y', 'tipo', 'de', 'célula', 'la', 'distribución', 'por', 'estadios', 'en', 'el', 'momento', 'del', 'diagnóstico', 'y', 'los', 'enfoques', 'diagnósticos', 'y', 'terapéuticos', 'estándar', 'o', 'típicos', 'utilizados', 'además', 'se', 'requieren', 'datos', 'sobre', 'la', 'progresión', 'de', 'la', 'enfermedad', 'tras', 'el', 'diagnóstico', 'inicial', 'en', 'función', 'de', 'la', 'edad', 'el', 'sexo', 'y', 'el', 'estadio', 'en', 'el', 'momento', 'del', 'diagnóstico', 'además', 'de', 'las', 'pautas', 'de', 'seguimiento', 'de', 'la', 'práctica', 'el', 'tratamiento', 'en', 'la', 'recaída', 'y', 'los', 'cuidados', 'terminales', 'por', 'lo', 'tanto', 'se', 'utilizan', '23', 'conjuntos', 'de', 'datos', 'diferentes', 'que', 'incluyen', 'diversos', 'registros', 'de', 'cáncer', 'y', 'registros', 'hospitalarios', 'datos', 'de', 'asociaciones', 'farmacéuticas', 'encuestas', 'de', 'salud', 'de', 'la', 'población', 'estudios', 'de', 'cribado', 'y', 'ensayos', 'clínicos', 'etc']","['caracterizar', 'población', 'ejemplo', 'evaluaciones', 'económicas', 'intervenciones', 'control', 'cáncer', 'pohem', 'suele', 'utilizar', 'muestra', 'simulación', 'millón', 'individuos', 'reúne', 'información', 'factores', 'riesgo', 'incidencia', 'enfermedad', 'edad', 'sexo', 'tipo', 'célula', 'distribución', 'estadios', 'momento', 'diagnóstico', 'enfoques', 'diagnósticos', 'terapéuticos', 'estándar', 'típicos', 'utilizados', 'requieren', 'datos', 'progresión', 'enfermedad', 'diagnóstico', 'inicial', 'función', 'edad', 'sexo', 'estadio', 'momento', 'diagnóstico', 'pautas', 'seguimiento', 'práctica', 'tratamiento', 'recaída', 'cuidados', 'terminales', 'utilizan', '23', 'conjuntos', 'datos', 'incluyen', 'diversos', 'registros', 'cáncer', 'registros', 'hospitalarios', 'datos', 'asociaciones', 'farmacéuticas', 'encuestas', 'salud', 'población', 'estudios', 'cribado', 'ensayos', 'clínicos', 'etc']","['caracterizar', 'población', 'ejemplo', 'evaluación', 'económico', 'intervención', 'control', 'cáncer', 'pohem', 'soler', 'utilizar', 'muestra', 'simulación', 'millón', 'individuo', 'reúnir', 'información', 'factor', 'riesgo', 'incidencia', 'enfermedad', 'edad', 'sexo', 'tipo', 'célula', 'distribución', 'estadio', 'momento', 'diagnóstico', 'enfoque', 'diagnóstico', 'terapéutico', 'estándar', 'típico', 'utilizado', 'requerir', 'dato', 'progresión', 'enfermedad', 'diagnóstico', 'inicial', 'función', 'edad', 'sexo', 'estadio', 'momento', 'diagnóstico', 'pauta', 'seguimiento', 'práctico', 'tratamiento', 'recaído', 'cuidado', 'terminal', 'utilizar', '23', 'conjunto', 'dato', 'incluir', 'diverso', 'registro', 'cáncer', 'registro', 'hospitalario', 'dato', 'asociación', 'farmacéutico', 'encuesta', 'salud', 'población', 'estudio', 'cribado', 'ensayo', 'clínico', 'etc']",caracterizar población ejemplo evaluación económico intervención control cáncer pohem soler utilizar muestra simulación millón individuo reúnir información factor riesgo incidencia enfermedad edad sexo tipo célula distribución estadio momento diagnóstico enfoque diagnóstico terapéutico estándar típico utilizado requerir dato progresión enfermedad diagnóstico inicial función edad sexo estadio momento diagnóstico pauta seguimiento práctico tratamiento recaído cuidado terminal utilizar 23 conjunto dato incluir diverso registro cáncer registro hospitalario dato asociación farmacéutico encuesta salud población estudio cribado ensayo clínico etc,3,3,3,ODS 3,ODS 3,ODS 3
al mismo tiempo el hecho de que los jóvenes que no estudian ni trabajan contribuyen cada vez más a la pobreza general en los países con las tasas de pobreza más bajas plantea la cuestión de si este indicador mide la pobreza real o simplemente la vulnerabilidad a la pobreza por lo tanto la configuración de las arquitecturas y responsabilidades políticas e institucionales debe diferir en consecuencia si bien esta edición del panorama social considera solo algunos de los aspectos básicos de este tipo de medición de la pobreza estos son suficientes para ilustrar las potencialidades y desafíos que presentan las mediciones multidimensionales,"['al', 'mismo', 'tiempo', 'el', 'hecho', 'de', 'que', 'los', 'jóvenes', 'que', 'no', 'estudian', 'ni', 'trabajan', 'contribuyen', 'cada', 'vez', 'más', 'a', 'la', 'pobreza', 'general', 'en', 'los', 'países', 'con', 'las', 'tasas', 'de', 'pobreza', 'más', 'bajas', 'plantea', 'la', 'cuestión', 'de', 'si', 'este', 'indicador', 'mide', 'la', 'pobreza', 'real', 'o', 'simplemente', 'la', 'vulnerabilidad', 'a', 'la', 'pobreza', 'por', 'lo', 'tanto', 'la', 'configuración', 'de', 'las', 'arquitecturas', 'y', 'responsabilidades', 'políticas', 'e', 'institucionales', 'debe', 'diferir', 'en', 'consecuencia', 'si', 'bien', 'esta', 'edición', 'del', 'panorama', 'social', 'considera', 'solo', 'algunos', 'de', 'los', 'aspectos', 'básicos', 'de', 'este', 'tipo', 'de', 'medición', 'de', 'la', 'pobreza', 'estos', 'son', 'suficientes', 'para', 'ilustrar', 'las', 'potencialidades', 'y', 'desafíos', 'que', 'presentan', 'las', 'mediciones', 'multidimensionales']","['tiempo', 'jóvenes', 'estudian', 'trabajan', 'contribuyen', 'pobreza', 'general', 'países', 'tasas', 'pobreza', 'bajas', 'plantea', 'cuestión', 'indicador', 'mide', 'pobreza', 'real', 'simplemente', 'vulnerabilidad', 'pobreza', 'configuración', 'arquitecturas', 'responsabilidades', 'políticas', 'institucionales', 'diferir', 'consecuencia', 'edición', 'panorama', 'social', 'aspectos', 'básicos', 'tipo', 'medición', 'pobreza', 'suficientes', 'ilustrar', 'potencialidades', 'desafíos', 'presentan', 'mediciones', 'multidimensionales']","['tiempo', 'joven', 'estudiar', 'trabajar', 'contribuir', 'pobreza', 'general', 'país', 'tasa', 'pobrezar', 'bajo', 'plantear', 'cuestión', 'indicador', 'medir', 'pobreza', 'real', 'simplemente', 'vulnerabilidad', 'pobrezar', 'configuración', 'arquitectura', 'responsabilidad', 'política', 'institucional', 'diferir', 'consecuencia', 'edición', 'panorama', 'social', 'aspecto', 'básico', 'tipo', 'medición', 'pobreza', 'suficiente', 'ilustrar', 'potencialidad', 'desafío', 'presentar', 'medición', 'multidimensional']",tiempo joven estudiar trabajar contribuir pobreza general país tasa pobrezar bajo plantear cuestión indicador medir pobreza real simplemente vulnerabilidad pobrezar configuración arquitectura responsabilidad política institucional diferir consecuencia edición panorama social aspecto básico tipo medición pobreza suficiente ilustrar potencialidad desafío presentar medición multidimensional,1,1,1,ODS 1,ODS 1,ODS 1
